id,text,timestamp,source,symbols,company_names,url,verified
1.01964E+18,Potential Winners And Losers In The Optical Space From The Tariff Dispute https://t.co/gZHuJf9Qra $AAOI $FNSR $NPTN $OCLR $FN $LITE,Wed Jul 18 18:05:00 +0000 2018,Benzinga,LITE,Lumentum Holdings Inc.,https://benzinga.com/z/12038851,TRUE
1.01964E+18,RT @SallyPancakes: .@jpmorgan's Jamie Dimon's note for @lloydblankfein posted on LinkedIn $GS $JPM (ht @readkrystalhu) https://t.co/YCFM06P…,Wed Jul 18 18:05:54 +0000 2018,devinbanerjee,JPM,JPMorgan Chase & Co.,,TRUE
1.01964E+18,RT @realmoney: #WallStreet Ignores $5 Billion EU Fine Against Alphabet🤷‍ #RealMoneySOD $GOOG $GOOGL @martincassidyst  https://t.co/kURssgGc…,Wed Jul 18 18:05:56 +0000 2018,jimcramer,GOOG,Alphabet Inc.,,TRUE
1.01964E+18,Haven't caught up on #WallStreet bank #earnings yet? Listen in on @BloombergRadio while I fill in @carolmassar on o… https://t.co/Tn8EYEbcrF,Wed Jul 18 18:08:05 +0000 2018,LauraJKeller,JPM,JPMorgan Chase & Co.,https://twitter.com/i/web/status/1019644993793921024,TRUE
1.01965E+18,RT @realmoney: #WallStreet Ignores $5 Billion EU Fine Against Alphabet🤷‍ #RealMoneySOD $GOOG $GOOGL @martincassidyst  https://t.co/kURssgGc…,Wed Jul 18 18:08:26 +0000 2018,TheStreet,GOOG,Alphabet Inc.,,TRUE
1.01965E+18,U.S. Housing Starts Unexpectedly Plunge 12.3% in June Permits Down 2.2%: https://t.co/oAxslClGOT by @MishGEA $XHB… https://t.co/y4E7ixjEnM,Wed Jul 18 18:19:04 +0000 2018,TheBubbleBubble,WFC,Wells Fargo & Company,https://www.themaven.net/mishtalk/economics/housing-starts-unexpectedly-plunge-12-3-in-june-permits-down-2-2-H6kZAn_vWU--Ua0Y3YFf5A/,TRUE
1.01965E+18,RT @Benzinga: One Insurer Just Gave A Glimpse Into How Autonomous Auto Insurance Will Work https://t.co/iqwTBBFYOy $F $GM $TSLA $TRV,Wed Jul 18 18:26:00 +0000 2018,Travelers,TRV,The Travelers Companies,https://benzinga.com/z/12033126,TRUE
1.01965E+18,This graphic and analysis about whether the Nike Vaporfly actually makes people faster is classic @UpshotNYT and is… https://t.co/C1B7E8dcKP,Wed Jul 18 18:27:37 +0000 2018,sarahhalzack,NKE,NIKE,https://twitter.com/i/web/status/1019649911753723905,TRUE
1.01965E+18,Former @Comcast employees like Rylinda Laterrica and Jennifer are speaking out about alleged workplace sexual hara… https://t.co/StQXc7YKd3,Wed Jul 18 18:29:50 +0000 2018,teamcoworker,CMCSA,Comcast Corporation,https://twitter.com/i/web/status/1019650467700277250,TRUE
1.01965E+18,Afternoon Price Volume Leaders $NFLX $AMZN $FB $AAPL $MSFT $GOOGL $MU $BABA $BRK.B $NVDA $BAC See the full list at… https://t.co/6d7iNdbFQf,Wed Jul 18 18:30:09 +0000 2018,Barchart,MU,Micron Technology,https://twitter.com/i/web/status/1019650547656339456,TRUE
1.01965E+18,Afternoon #Options Volume Leaders $BAC $JD $MU $AAL $CMCSA $FOXA $NFLX See the full list at https://t.co/gT09fRBUzS… https://t.co/yGcOjc6J2i,Wed Jul 18 18:32:56 +0000 2018,Barchart,AAL,American Airlines Group Inc.,http://Barchart.com,TRUE
1.01965E+18,Morgan Stanley: Nvidia 'The Cleanest Growth Story In Semis' With New Products Ahead https://t.co/kBPIURtfbu $AMD $NVDA,Wed Jul 18 18:39:49 +0000 2018,JasonRaznick,AMD,Advanced Micro Devices,https://benzinga.com/z/12030469,TRUE
1.01966E+18,Sarissa Capital Management's Alex Denner's #DeliveringAlpha best idea is $BIIB which is up 0.5% as he starts his presentation,Wed Jul 18 19:02:31 +0000 2018,AnnekenTappe,BIIB,Biogen Inc.,,TRUE
1.01966E+18,Sarissa Capital's Alex Denner talks Biogen $BIIB (he's a board member) at #DeliveringAlpha,Wed Jul 18 19:03:51 +0000 2018,carletonenglish,BIIB,Biogen Inc.,,TRUE
1.01966E+18,The bar is incredibly low for @generalelectric when it reports second-quarter earnings Friday morning. https://t.co/CTtBWXXTcn $GE,Wed Jul 18 19:04:05 +0000 2018,usnews,GE,General Electric Company,https://trib.al/2ziV9o4,TRUE
1.01966E+18,RT @amandakcantrell: Next up: Alexander Denner of Sarissa Capital Management which does activist investing in health care. Likes Biogen $B…,Wed Jul 18 19:05:41 +0000 2018,DeliveringAlpha,BIIB,Biogen Inc.,,TRUE
1.01966E+18,Investment bank @MorganStanley topped forecasts for its second quarter. https://t.co/Wk4Jyspqjc $MS,Wed Jul 18 19:07:34 +0000 2018,usnews,MS,Morgan Stanley,https://trib.al/HReTiu8,TRUE
1.01966E+18,Investors don't like a stock that doesn't show a big upside. But Sarissa Capital's chief investment officer likes… https://t.co/prd3a4q0W7,Wed Jul 18 19:07:50 +0000 2018,iimag,BIIB,Biogen Inc.,https://twitter.com/i/web/status/1019660032286347264,TRUE
1.01966E+18,"Denner talking $BIIB: Aducanumab in Alzheimer's ""could become the largest drug in the world... or it may not work… https://t.co/PVWVwwehQe",Wed Jul 18 19:07:56 +0000 2018,megtirrell,BIIB,Biogen Inc.,https://twitter.com/i/web/status/1019660056554622976,TRUE
1.01966E+18,https://t.co/0M8T2DD80f New position in $SQQQ Tech Stocks are overbought  .... SQQQ technicals look pretty juicy.  This is a trade,Wed Jul 18 19:08:37 +0000 2018,AGORACOM,SQQQ,ProShares UltraPro Short QQQ,https://profit.ly/1Mvi0f,TRUE
1.01966E+18,Denner of $BIVV spinout: The board of $BIIB is focused on that kind of thing and we'll try to do it more #DeliveringAlpha,Wed Jul 18 19:09:36 +0000 2018,megtirrell,BIIB,Biogen Inc.,,TRUE
1.01966E+18,The average age of @xfinitymobile customer is 49.2 years old which is older than Verizon’s base (47.7) AT&amp;T’s bas… https://t.co/DsJVKEyP28,Wed Jul 18 19:10:00 +0000 2018,FierceWireless,VZ,Verizon Communications Inc.,https://twitter.com/i/web/status/1019660576522407936,TRUE
1.01966E+18,RT @megtirrell: Denner of $BIVV spinout: The board of $BIIB is focused on that kind of thing and we'll try to do it more #DeliveringAlpha,Wed Jul 18 19:10:15 +0000 2018,DeliveringAlpha,BIIB,Biogen Inc.,,TRUE
1.01966E+18,@Value_equity The Barchart Technical Opinion rating is a 16% Sell with a Weakening short term outlook on maintainin… https://t.co/ECmWFecttK,Wed Jul 18 19:10:57 +0000 2018,Barchart,AAL,American Airlines Group Inc.,https://twitter.com/i/web/status/1019660815161536512,TRUE
1.01966E+18,@Optionsonar1 The Barchart Technical Opinion rating is a 16% Sell with a Weakening short term outlook on maintainin… https://t.co/S7gDWhcFca,Wed Jul 18 19:11:21 +0000 2018,Barchart,AAL,American Airlines Group Inc.,https://twitter.com/i/web/status/1019660916210720769,TRUE
1.01966E+18,@meirbarak The Barchart Technical Opinion rating is a 16% Sell with a Weakening short term outlook on maintaining t… https://t.co/nCZn9Ncywr,Wed Jul 18 19:11:31 +0000 2018,Barchart,AAL,American Airlines Group Inc.,https://twitter.com/i/web/status/1019660957935702017,TRUE
1.01966E+18,$BA Bot 07/27/2018 367.50 C for $5.50 bc of 👇👇 https://t.co/skp3SUd2r4,Wed Jul 18 19:11:40 +0000 2018,OphirGottlieb,BA,The Boeing Company,https://twitter.com/OphirGottlieb/status/1016779533691674624,TRUE
1.01966E+18,@NickPoulopoulos The Barchart Technical Opinion rating is a 16% Sell with a Weakening short term outlook on maintai… https://t.co/jeL5HfYD3L,Wed Jul 18 19:12:46 +0000 2018,Barchart,AAL,American Airlines Group Inc.,https://twitter.com/i/web/status/1019661271178842122,TRUE
1.01966E+18,@OptionsMamba The Barchart Technical Opinion rating is a 16% Sell with a Weakening short term outlook on maintainin… https://t.co/RqMDAWoAbT,Wed Jul 18 19:12:52 +0000 2018,Barchart,AAL,American Airlines Group Inc.,https://twitter.com/i/web/status/1019661297137455104,TRUE
1.01966E+18,@NickPoulopoulos The Barchart Technical Opinion rating is a 16% Sell with a Weakening short term outlook on maintai… https://t.co/nf3wgardWQ,Wed Jul 18 19:12:57 +0000 2018,Barchart,AAL,American Airlines Group Inc.,https://twitter.com/i/web/status/1019661317655973888,TRUE
1.01966E+18,.@GuyAdami asks Denner what happens if $BIIB Alzheimer's program fails? Denner says the underlying business support… https://t.co/I7gayiTJzM,Wed Jul 18 19:13:40 +0000 2018,megtirrell,BIIB,Biogen Inc.,https://twitter.com/i/web/status/1019661500364058625,TRUE
1.01966E+18,Asked by @MelissaLeeCNBC about $BIIB M&amp;A strategy Denner says only wants to do deals that would be DCF-positive #DeliveringAlpha,Wed Jul 18 19:14:38 +0000 2018,megtirrell,BIIB,Biogen Inc.,,TRUE
1.01966E+18,RT @KatherineRooss: Samantha Greenberg of Margate feels bullish on video game stocks like $TTWO $EA $ATVI. Do you? https://t.co/yrIv3JXLP5,Wed Jul 18 19:15:41 +0000 2018,TheStreet,EA,Electronic Arts Inc.,https://www.thestreet.com/markets/delivering-alpha-conference-live-blog-14654222,TRUE
1.01966E+18,$MS 👀👀👇👇👇 https://t.co/AfgZt3tcH3,Wed Jul 18 19:19:56 +0000 2018,OphirGottlieb,MS,Morgan Stanley,https://twitter.com/CMLviz/status/1019662966453489665,TRUE
1.01967E+18,RT @TheBubbleBubble: U.S. Housing Starts Unexpectedly Plunge 12.3% in June Permits Down 2.2%: https://t.co/oAxslClGOT by @MishGEA $XHB $WF…,Wed Jul 18 19:35:00 +0000 2018,DougKass,WFC,Wells Fargo & Company,https://www.themaven.net/mishtalk/economics/housing-starts-unexpectedly-plunge-12-3-in-june-permits-down-2-2-H6kZAn_vWU--Ua0Y3YFf5A/,TRUE
1.01967E+18,Analysts say @Visa should benefit from robust consumer spending. https://t.co/x0u9uzI9PA $V,Wed Jul 18 20:03:09 +0000 2018,usnews,V,Visa Inc.,https://trib.al/9TtRh1K,TRUE
1.01968E+18,Here are just a couple of the trades today from the Steamroom  in names like $AMAT $ERIC $GS $NCLH $GWW $BAC $BA… https://t.co/GFDtdV3Z9s,Wed Jul 18 20:08:29 +0000 2018,sanglucci,AMAT,Applied Materials,https://twitter.com/i/web/status/1019675294137974785,TRUE
1.01968E+18,Higher credit card spending drives American Express profit gain https://t.co/EjsW8q4j66 $AXP https://t.co/js3i6OFLSG,Wed Jul 18 20:20:25 +0000 2018,ReutersBiz,AXP,American Express Company,https://reut.rs/2utDd5R,TRUE
1.01968E+18,Bulls triple their money in $PG https://t.co/VjnGSEAxEc via @investitute,Wed Jul 18 20:23:38 +0000 2018,jonnajarian,PG,The Procter & Gamble Company,http://zpr.io/6XBPf,TRUE
1.01968E+18,"That familiar refrain: ""We're No. 1."" No -- ""WE'RE No. 1."" More than one investment bank tries to claim Wall Stre… https://t.co/oXxYnoOb0Q",Wed Jul 18 20:24:17 +0000 2018,LauraJKeller,JPM,JPMorgan Chase & Co.,https://twitter.com/i/web/status/1019679269503500288,TRUE
1.01968E+18,$KMI reports FQ2 earnings of 21c EPS and $3.43B Revs - https://t.co/mLfrlAZwA0,Wed Jul 18 20:24:45 +0000 2018,Estimize,KMI,Kinder Morgan,http://www.estimize.com/kmi/fq2-2018?utm_content=release_actuals&utm_medium=tweet&utm_source=twitter,TRUE
1.01968E+18,$KMI reports inline with the Estimize EPS Consensus and misses the Estimize Revenue Consensus by $22.99M. Reports F… https://t.co/b361kkBY2N,Wed Jul 18 20:24:46 +0000 2018,Estimize,KMI,Kinder Morgan,https://twitter.com/i/web/status/1019679390857416705,TRUE
1.01968E+18,Well done rama2050 beating 53 other analysts and the Wall Street Consensus to take the win for $KMI - https://t.co/PYU4oSZQ7s,Wed Jul 18 20:24:47 +0000 2018,Estimize,KMI,Kinder Morgan,http://www.estimize.com/kmi/fq2-2018?utm_content=release_winner&utm_medium=tweet&utm_source=twitter,TRUE
1.01968E+18,Once More Unto The Bleach: Goldman Sachs Downgrades Clorox https://t.co/o89IZmfKuJ $CLX,Wed Jul 18 20:25:00 +0000 2018,Benzinga,CLX,The Clorox Company,https://benzinga.com/z/12038248,TRUE
1.01968E+18,Bulls triple their money in $PG https://t.co/A2LXyOpcoo via @investitute,Wed Jul 18 20:26:11 +0000 2018,petenajarian,PG,The Procter & Gamble Company,http://zpr.io/6XBPf,TRUE
1.01968E+18,#Alcierre $IPC avanza 0.61% a 49003 pts. Alzas $ELEKTR $CEMEX $GFNORT Bajas $LAB $CUERVO $PEOLES SIC $CHKP  $ABX… https://t.co/6cRbDxPj2z,Wed Jul 18 20:26:17 +0000 2018,GBMhomebroker,ABX,Barrick Gold Corporation,https://twitter.com/i/web/status/1019679775181430786,TRUE
1.01968E+18,Najarian Brothers See Unusual Option Activity in $HLT $FTI $BSX $WBA &amp; $MSFT https://t.co/6frU0jUT7g via @investitute,Wed Jul 18 20:28:43 +0000 2018,jonnajarian,HLT,Hilton Worldwide Holdings Inc.,http://zpr.io/6XB6K,TRUE
1.01968E+18,RT @tpetruno: Transports on fire today on earnings optimism:  UnitedAir $UAL +8.8% $CSX +7.1 Delta $DAL +3.3 NorfolkSouthern $NSC +3.2 Amer…,Wed Jul 18 20:30:46 +0000 2018,jennablan,AAL,American Airlines Group Inc.,,TRUE
1.01968E+18,Najarian Brothers See Unusual Option Activity in $HLT $FTI $BSX $WBA &amp; $MSFT https://t.co/5hBnZjjHB0 via @investitute,Wed Jul 18 20:30:53 +0000 2018,petenajarian,HLT,Hilton Worldwide Holdings Inc.,http://zpr.io/6XB6K,TRUE
1.01968E+18,Goldman Sachs vs. Morgan Stanley - which bank will win the battle for M&amp;A dollars? https://t.co/8uKgZFbTc3… https://t.co/xBb1lMTMzT,Wed Jul 18 20:31:36 +0000 2018,ScottGamm,MS,Morgan Stanley,https://www.thestreet.com/video/goldman-sachs-vs-morgan-stanley-the-battle-for-ma-dollars-14655129,TRUE
1.01968E+18,RT @ScottGamm: Goldman Sachs vs. Morgan Stanley - which bank will win the battle for M&amp;A dollars? https://t.co/8uKgZFbTc3 @TheStreet @MBro…,Wed Jul 18 20:31:58 +0000 2018,TheStreet,MS,Morgan Stanley,https://www.thestreet.com/video/goldman-sachs-vs-morgan-stanley-the-battle-for-ma-dollars-14655129,TRUE
1.01968E+18,Kinder Morgan reports quarterly loss from Oklahoma impairment $KMI https://t.co/0Qo8kricjX via @houstonchron,Wed Jul 18 20:32:17 +0000 2018,JDBlum23,KMI,Kinder Morgan,https://www.chron.com/business/energy/article/Kinder-Morgan-reports-quarterly-loss-from-13085937.php?utm_campaign=twitter-desktop&utm_source=CMS%20Sharing%20Button&utm_medium=social,TRUE
1.01968E+18,RT @realmoney: Bath Bombs and Muscle Creams: How #Beauty Is Becoming the Fast Lane for Cannabis Growth by #RealMoney Exectutive Editor @dar…,Wed Jul 18 20:33:21 +0000 2018,dariasolo,SBUX,Starbucks Corporation,,TRUE
1.01968E+18,After hours earnings movers: $IBM $EBAY $AXP https://t.co/p2ktJacPyt,Wed Jul 18 20:35:22 +0000 2018,CNBCClosingBell,AXP,American Express Company,,TRUE
1.01968E+18,RT @geoffreymorgan: Kinder Morgan Inc. $KMI executive chairman Rich Kinder says the firm will use cash from the sale of its Trans Mountain…,Wed Jul 18 20:45:32 +0000 2018,TaraNWeber,KMI,Kinder Morgan,,TRUE
1.01968E+18,Closing Bell hit talked $EBAY next up a wrap up of Delivering Alpha - Everyday its about Delivering Alpha https://t.co/vHU2NAI8H1,Wed Jul 18 20:45:56 +0000 2018,petenajarian,EBAY,eBay Inc.,https://twitter.com/PetesAssistant/status/1019681646591795200,TRUE
1.01969E+18,Didn't see this tweet until now Dan one could have closed this trade for ~ $3.20 before the close most of max val… https://t.co/1tX5qHxw81,Wed Jul 18 20:48:04 +0000 2018,Michael_Khouw,AXP,American Express Company,https://twitter.com/i/web/status/1019685254922100737,TRUE
1.01969E+18,In 10 minutes we'll kick off our $EBAY Q2 2018 earnings webcast. Follow live tweets here or listen at https://t.co/t2ELrR0Rur,Wed Jul 18 20:50:00 +0000 2018,eBayNewsroom,EBAY,eBay Inc.,https://bit.ly/2LgTOU3,TRUE
1.01969E+18,Our earnings webcast has begun. Follow along for @eBay CEO @DevinWenig’s remarks on $EBAY’s Q2 results. https://t.co/t2ELrR0Rur,Wed Jul 18 21:01:47 +0000 2018,eBayNewsroom,EBAY,eBay Inc.,https://bit.ly/2LgTOU3,TRUE
1.01969E+18,Wenig: In Q2 we continued to execute our strategy while pursuing significant opportunities in advertising and paym… https://t.co/KmgxSGlZZS,Wed Jul 18 21:04:17 +0000 2018,eBayNewsroom,EBAY,eBay Inc.,https://twitter.com/i/web/status/1019689337166991360,TRUE
1.01969E+18,Wenig: With the addition of buyers from our recent acquisition in Japan active buyers grew 4% on a pro-forma basis… https://t.co/Tt4EvgtVv0,Wed Jul 18 21:05:29 +0000 2018,eBayNewsroom,EBAY,eBay Inc.,https://twitter.com/i/web/status/1019689639622463488,TRUE
1.01969E+18,Wenig: We are focusing to an even greater extent on $EBAY initiatives that have the greatest impact on our customer… https://t.co/ELxAjVny0A,Wed Jul 18 21:05:41 +0000 2018,eBayNewsroom,EBAY,eBay Inc.,https://twitter.com/i/web/status/1019689691069734920,TRUE
1.01969E+18,Wenig: We continue to build on our structured data efforts including our new product-based commerce experience. $EBAY,Wed Jul 18 21:05:58 +0000 2018,eBayNewsroom,EBAY,eBay Inc.,,TRUE
1.01969E+18,Bulls wake up to profits in $HLT https://t.co/ubHoPFe1ta via @investitute,Wed Jul 18 21:06:12 +0000 2018,petenajarian,HLT,Hilton Worldwide Holdings Inc.,http://zpr.io/6XBEq,TRUE
1.01969E+18,Wenig: We continue to scale Guaranteed Delivery in the US and we recently launched in Australia. We exited Q2 with… https://t.co/el3lv7pNYa,Wed Jul 18 21:06:39 +0000 2018,eBayNewsroom,EBAY,eBay Inc.,https://twitter.com/i/web/status/1019689932246388737,TRUE
1.01969E+18,Bulls wake up to profits in $HLT https://t.co/Ffp6w6UEBF via @investitute,Wed Jul 18 21:07:46 +0000 2018,jonnajarian,HLT,Hilton Worldwide Holdings Inc.,http://zpr.io/6XBEq,TRUE
1.01969E+18,Following @Target's announcement today that it experienced its largest online shopping day of 2018 on @amazon's Jul… https://t.co/LEOoNJokaB,Wed Jul 18 21:08:39 +0000 2018,MoodysInvSvc,TGT,Target Corporation,https://twitter.com/i/web/status/1019690437777543169,TRUE
1.01969E+18,Wenig: We are making good progress on building out managed payments on $EBAY. Product development is well underway… https://t.co/eYUoTbEFw5,Wed Jul 18 21:09:07 +0000 2018,eBayNewsroom,EBAY,eBay Inc.,https://twitter.com/i/web/status/1019690552936329221,TRUE
1.01969E+18,RT @petenajarian: Bulls wake up to profits in $HLT https://t.co/ubHoPFe1ta via @investitute,Wed Jul 18 21:11:53 +0000 2018,petenajarian,HLT,Hilton Worldwide Holdings Inc.,http://zpr.io/6XBEq,TRUE
1.01969E+18,Wenig: We continue to make progress improving the $EBAY customer experience and we expect core acceleration in the… https://t.co/qNJXNnTHAP,Wed Jul 18 21:11:54 +0000 2018,eBayNewsroom,EBAY,eBay Inc.,https://twitter.com/i/web/status/1019691254047739907,TRUE
1.01969E+18,. @MCaruso_Cabrera asks about $FB. #SteveBannon “evil”. Data should be in public trust stop convergence of power… https://t.co/5YzLxihBJh,Wed Jul 18 21:15:37 +0000 2018,DeliveringAlpha,GOOG,Alphabet Inc.,https://twitter.com/i/web/status/1019692190778429441,TRUE
1.01969E+18,As brick-and-mortars push into online sales which stocks will be labeled as e-commerce and which won't?… https://t.co/xZgW7gqxiB,Wed Jul 18 21:17:52 +0000 2018,TDANetwork,TRIP,TripAdvisor,https://twitter.com/i/web/status/1019692755730214912,TRUE
1.01969E+18,SCOOP: Amazon has gone on the record to deny that it will challenge Cisco by selling network switches to other busi… https://t.co/S3koeNjq0j,Wed Jul 18 21:18:18 +0000 2018,jowens510,CSCO,Cisco Systems,https://twitter.com/i/web/status/1019692863825752064,TRUE
1.01969E+18,RT @jowens510: SCOOP: Amazon has gone on the record to deny that it will challenge Cisco by selling network switches to other businesses. h…,Wed Jul 18 21:18:34 +0000 2018,MarketWatch,CSCO,Cisco Systems,,TRUE
1.01969E+18,US stocks edge higher as airlines railroads and banks jump $UNP $TXN $MS $BRK.B $NTRS $UAL $GOOGL https://t.co/Mwrb3BQYIX via @Barchart,Wed Jul 18 21:20:09 +0000 2018,Barchart,GOOGL,Alphabet Inc.,https://www.barchart.com/share/news/936727,TRUE
1.01969E+18,RT @jowens510: SCOOP: Amazon has gone on the record to deny that it will challenge Cisco by selling network switches to other businesses. h…,Wed Jul 18 21:21:38 +0000 2018,itstheannmarie,CSCO,Cisco Systems,,TRUE
1.01969E+18,Netflix To Bring Comedy To New Sirius XM Channel https://t.co/vKpwcAb6Gj $NFLX $SIRI $SPOT $T $AMZN $DIS,Wed Jul 18 21:25:00 +0000 2018,Benzinga,NFLX,Netflix,https://benzinga.com/z/12038245,TRUE
1.01969E+18,$CSCO stock now up 3% in after-hours trading.,Wed Jul 18 21:26:09 +0000 2018,jowens510,CSCO,Cisco Systems,,TRUE
1.0197E+18,RT @jowens510: SCOOP: Amazon has gone on the record to deny that it will challenge Cisco by selling network switches to other businesses. h…,Wed Jul 18 21:27:12 +0000 2018,kelseymsutton,CSCO,Cisco Systems,,TRUE
1.0197E+18,Now $CSCO up 3.65% after hours on report denying that $AMZN has current plans to compete directly with Cisco by sel… https://t.co/GZYUKstOzy,Wed Jul 18 21:27:33 +0000 2018,MattRosoff,CSCO,Cisco Systems,https://twitter.com/i/web/status/1019695190703988736,TRUE
1.0197E+18,Why Google's record antitrust fine 'doesn't matter' $GOOG $GOOGL https://t.co/oCdxAdjks2 by @JPManga https://t.co/xWNJGeb7l9,Wed Jul 18 21:31:03 +0000 2018,YahooFinance,GOOG,Alphabet Inc.,https://yhoo.it/2L7nsMf,TRUE
1.0197E+18,RT @jowens510: SCOOP: Amazon has gone on the record to deny that it will challenge Cisco by selling network switches to other businesses. h…,Wed Jul 18 21:39:37 +0000 2018,jolshan,CSCO,Cisco Systems,,TRUE
1.0197E+18,Nice $CSCO $AMZN scoop by @MarketWatch tech editor @jowens510 https://t.co/WC1LZljszE,Wed Jul 18 21:47:55 +0000 2018,tpoletti,CSCO,Cisco Systems,https://www.marketwatch.com/story/exclusive-amazon-denies-it-will-challenge-cisco-with-switch-sales-2018-07-18,TRUE
1.0197E+18,$MS call buyers bank quick gains https://t.co/7TvwHfXiCn via @investitute,Wed Jul 18 21:52:16 +0000 2018,petenajarian,MS,Morgan Stanley,http://zpr.io/6XB2k,TRUE
1.0197E+18,$MSFT is reporting after the bell Thursday and @RiskReversal says the options market is expecting a big swing. https://t.co/BDwvh3tpbW,Wed Jul 18 21:52:21 +0000 2018,OptionsAction,MSFT,Microsoft Corporation,,TRUE
1.0197E+18,$MS call buyers bank quick gains https://t.co/rQjRdxbZci via @investitute,Wed Jul 18 21:53:16 +0000 2018,jonnajarian,MS,Morgan Stanley,http://zpr.io/6XB2k,TRUE
1.0197E+18,RT @jowens510: SCOOP: Amazon has gone on the record to deny that it will challenge Cisco by selling network switches to other businesses. h…,Wed Jul 18 21:58:00 +0000 2018,wmwitkowski,CSCO,Cisco Systems,,TRUE
1.0197E+18,"RT @MattRosoff: Microsoft $MSFT chairman John Thompson recallng Satya's first day: ""He never mentioned Windows one time."" https://t.co/WS9c…",Wed Jul 18 22:01:19 +0000 2018,JCMcCracken,MSFT,Microsoft Corporation,,TRUE
1.0197E+18,Ohmygod I missed this! no no no! #Timestamp! #Timestamp! $OSTK $MDXG $AMD $BUM $HALFWIT https://t.co/uP0XeheYib,Wed Jul 18 22:03:27 +0000 2018,gary_weiss,AMD,Advanced Micro Devices,https://twitter.com/sequenceinc/status/1017458916479897600,TRUE
1.01971E+18,Still here to tell you about #WallStreet #earnings this time with a #tradewars tact for @bloombergTV Asia. I'll be… https://t.co/7d8KXJADlL,Wed Jul 18 22:10:34 +0000 2018,LauraJKeller,JPM,JPMorgan Chase & Co.,https://twitter.com/i/web/status/1019706019142922240,TRUE
1.01971E+18,For @BloombergTV today: Roundup of some of the most important parts of 2Q #WallStreet earnings… https://t.co/nZuP1GCvul,Wed Jul 18 22:16:29 +0000 2018,LauraJKeller,JPM,JPMorgan Chase & Co.,https://twitter.com/i/web/status/1019707505037987840,TRUE
1.01971E+18,RT @davidnelsoncfa: On the way into #timessquare @i24NEWS_EN #economy $IBM $GOOGL ON DECK. 7:30EST.,Wed Jul 18 22:18:28 +0000 2018,tomborelli,GOOGL,Alphabet Inc.,,TRUE
1.01971E+18,The price of lumber $LB_F is down 22% since hitting its YTD highs. The Macy's $M turnaround is still happening.… https://t.co/XnKsV4De39,Wed Jul 18 22:22:47 +0000 2018,StockTwits,CAT,Caterpillar Inc.,https://twitter.com/i/web/status/1019709091038547968,TRUE
1.01971E+18,Finding Value In A New High-Yield ETF https://t.co/7rpaJ3roSD $HYGV $NTRS,Wed Jul 18 22:25:00 +0000 2018,Benzinga,NTRS,Northern Trust Corporation,https://benzinga.com/z/12040475,TRUE
1.01971E+18,https://t.co/tzaYzlB3EC Exclusive: Amazon denies it will challenge Cisco with switch sales via @YahooFinance - $AMZN $CSCO $ANET,Wed Jul 18 22:25:05 +0000 2018,OphirGottlieb,CSCO,Cisco Systems,https://www.marketwatch.com/story/exclusive-amazon-denies-it-will-challenge-cisco-with-switch-sales-2018-07-18?siteid=yhoof2&yptr=yahoo,TRUE
1.01971E+18,https://t.co/tpI6WoyTtf How Microsoft Is Winning Some of Amazon’s Business - $MSFT,Wed Jul 18 22:26:10 +0000 2018,OphirGottlieb,MSFT,Microsoft Corporation,http://marketrealist.com/2018/07/how-microsoft-is-winning-some-of-amazons-business/?utm_source=yahoo&utm_medium=feed&yptr=yahoo,TRUE
1.01971E+18,RT @MattRosoff: Now $CSCO up 3.65% after hours on report denying that $AMZN has current plans to compete directly with Cisco by selling swi…,Wed Jul 18 22:34:51 +0000 2018,lexnfx,CSCO,Cisco Systems,,TRUE
1.01971E+18,As we know Mark Zuckerberg has no morals and would take money from the devil if placing a boosted post on Facebook. $FB,Wed Jul 18 22:44:55 +0000 2018,GerberKawasaki,FB,Facebook,,TRUE
1.01971E+18,RT @crackr: #Facebook-Chef Mark Zuckerberg wird im re/code-Interview von Techreporterin Kara Swisher gegrillt: “Du hast genug Dinge kaputt…,Wed Jul 18 22:45:27 +0000 2018,ufomedia,FB,Facebook,,TRUE
1.01972E+18,RT @IBDinvestors: $WMT is considering a subscription &amp; free ad supported video service which could begin to rival $AMZN &amp; $NFLX. Can $WMT p…,Wed Jul 18 22:49:54 +0000 2018,GerberKawasaki,NFLX,Netflix,,TRUE
1.01972E+18,Cisco Systems Inc. $CSCO up 2.49% in After hours trade on news....... Exclusive: Amazon denies it will challenge C… https://t.co/FBqlluFdQR,Wed Jul 18 22:51:26 +0000 2018,CommSec,CSCO,Cisco Systems,https://twitter.com/i/web/status/1019716304180207616,TRUE
1.01972E+18,Thank you Wells Fargo. We appreciate all the new clients who prefer human money management with an independent fidu… https://t.co/mDi0Fl0lpU,Wed Jul 18 22:52:56 +0000 2018,GerberKawasaki,WFC,Wells Fargo & Company,https://twitter.com/i/web/status/1019716680769986562,TRUE
1.01972E+18,RT @StockTwits: The price of lumber $LB_F is down 22% since hitting its YTD highs. The Macy's $M turnaround is still happening.  Caterpil…,Wed Jul 18 22:55:18 +0000 2018,howardlindzon,CAT,Caterpillar Inc.,,TRUE
1.01972E+18,Get inspired by these 5 quotes if you're considering entering the stock market https://t.co/olehF8sv36 study hard $FB $TWTR,Wed Jul 18 23:01:18 +0000 2018,timothysykes,FB,Facebook,https://goo.gl/3jU16i,TRUE
